,0
0,"It runs Android 11 with full Play Store access so it's been awesome getting things on here like Reddit, Google News, the Kindle app, etc. and not being restricted to the software preloaded by the manufacturer. A lot more than my Kindle Oasis can do despite being much smaller.

I've also been super impressed with how snappy and fast this thing is when navigating the UI, opening apps, waking up, turning on/off, etc. Much better performance than my Kindle or my Supernote."
1,am just waiting for one with color and sim card. Buying that on the first day
2,I have a Hisense Touch which is a similar size and love it too. So convenient
3,I am really tempted to pick one of these up to replace my Kindle.  I love the form factor.  I side load most of my books to my Kindle so being able to use another app that allows scrolling instead of page turns is also a plus.
4,Battery life?
5,"Are you using it with the front light on? How sharp is it without the front on?

What other apps have you got on it, like telegram or Whatsapp?"
6,Is this the perfect reddit phone ? Or the perfect phone for articles to read ? 
7,"Would something like this also have access to the kobo app and Libby? I’m not too familiar with the android software. I’m guessing this could be a really neat option for someone using a few different sources for books. I’m using Amazon, kobo and Libby but have both a kindle and a kobo device."
8,I want to get this but I’m afraid it will be too small to read. Does it bother your eyes at all? I would mainly use it to read books.
9,"Have you used the camera for scanning QR codes? I don't have an Android (or iOS) device, so I'm considering this for reading on the go + Duolingo without straining my eyes + things that require apps like Uber and Yulu (shared bike/cycle service in India).

Unfortunately I doubt banking apps will work because most of them insist you insert the SIM card of the number linked to your bank account...but it would come in handy for other things!"
10,Where did you purchase it?
11,any options for cell phone data
12,@Bossman1086 Would you be so kind to check if you can download the app „Shortform“? This would be the reason for me to buy this device
13,"That already exists! For example, check out the Hisense A7 CC."
14,"The form factor is pretty nice. It's small though. Make sure you'd be good reading on a smaller screen regularly. To me, it's a great companion device to my phone and an ereader I'll probably take with me when I don't want something as big as my Kindle. But if I'm traveling, I think the Kindle will still be better for me on the plane and such."
15,I've only had it for like 2 days so it's too early to say. I've only done 20 minutes of Kindle reading on it and less than an hour of news/reddit reading so far. Otherwise it's been sitting on my desk as a clock/calendar. It came at 83% battery and is currently at 64% without being charged.
16,"Yes, I'm using it with the light on. Default brightness settings. I turned it off for a bit and it was still perfectly sharp.

As for apps, I haven't installed any messaging apps. I got it as a companion device to get away from phone distractions and notifications so I avoided messaging, email, and most social media apps. But most of them should work since it's running Android 11 with the Play Store and a Snapdragon processor that was common in mid-range phones a couple years ago. Messaging apps will depend on whether or not they require a phone number though since this device has no SIM or phone number.

Apps I've installed include Pocket, Kindle, Brave, RedReader for reddit, Google News, Gboard, Play Books, Keep Notes, Open Camera, X, and Tachiyomi (side loaded)."
17,"It's not a phone. It has no SIM or mobile radios. No way to make calls. 

But yes. It's like reading on a phone but with an eInk display. So like reading on a Kindle, your eyes won't get sore reading for long periods of time on it. In my experience so far, it's been great for reading the news and browsing some text heavy websites. I don't do much reddit on mobile but it should be good for that if you're not in card view."
18,There is a Kobo app for Android in the Play Store. So you could definitely install that and read your books in that library on this device. I'm doing that with the Kindle app as that's where 90% of my eBooks are.
19,Hi what’s the difference between the kindle store and kobo store? Difference in pricing like Barnes and noble for nook?
20,"It's no different than reading on a phone screen (besides it being an eInk display, anyway). I read random articles and reddit posts on my phone all the time without issue. And eInk is even easier on the eyes than an AMOLED display in a phone.

No issues so far."
21,The device doesn't come with a standard camera app but you can download one from the store. QR code support depends on the camera app you get. There are also stand alone QR code reader apps in the play store that should work.
22,No. It's not a phone. No modems. Has WiFi and Bluetooth. That's it.
23,If you want data get a Hisense A9.
24,the size is not ideal for me. Plus i want one with the latest kaleido 3
25,"I have an iPhone 13 Pro Max so I've been experimenting with reading on it and the size is great.  Besides the fact that I'm just a sucker for a new gadget,  I think an E-ink screen would be a huge improvement plus it would keep me from distracting myself with my phone."
26,"Just to follow up, they came back in stock at B&H so I ordered one.  Christmas present to myself I suppose."
27,"Thank you, but I still need to find someone that has used it for reddit reading. Like literally most of my screen time I'm reading something so if this could be done on an e ink screen it would actually benefit my eyes. 

the problem with kindle is that it does not support a web browser. I have seen other boox products and I'm really tempted to buy one to try them"
28,Different book formats would be the biggest difference.
29,Ok thank you!
30,"Hmm, okay, I think one of those should work for me! Thanks :)"
31,"interesting just wanted clarification, would love one as a phone i kind of need less blue light into my eyes on the daily."
32,"I'd actually love this as a phone too, it'd do a great job as a 'digital detox' phone."
33,"I'd actually love this as a phone too, it'd do a great job as a 'digital detox' phone."
34,thanks ill look into it
35,This has full access to the Play Store. So almost any app you can download from there should work on this. I have installed the reddit app and it does work. I just haven't spent much time in it on this device. I don't see any reason why it wouldn't be good for reddit though. It's just not good for videos/gifs and photos because it's black and white.
36,"it'd be awesome if they came out with like 3 sizes (mini,regular,plus) with the next lineup! it would be awesome for people to have 3 options."
37,[deleted]
38,"Yes, please. I hope they don't make it the 'low-performance' version though.  "
39,Probably good to have a 4 inch option for some. But im never going back to that size after having a 4.7 inch screen. 
40,"I have left reddit for [Voat](https://voat.co/) due to years of admin mismanagement and preferential treatment for certain subreddits and users holding certain political and ideological views.  

   As an act of protest, I have chosen to redact all the comments I've ever made on reddit, overwriting them with this message.  

   If you would like to do the same, install [TamperMonkey](https://chrome.google.com/webstore/detail/tampermonkey/dhdgffkkebhmkfjojejmpbldmpobfkfo) for Chrome, [GreaseMonkey](https://addons.mozilla.org/en-us/firefox/addon/greasemonkey/) for Firefox, [NinjaKit](https://github.com/os0x/NinjaKit) for Safari, [Violent Monkey](https://addons.opera.com/en/extensions/details/violent-monkey/) for Opera, or [AdGuard](http://adguard.com/) for Internet Explorer (in Advanced Mode), then add [this GreaseMonkey script](https://greasyfork.org/en/scripts/10905-reddit-overwrite-extended).   

 Finally, click on your username at the top right corner of reddit, click on comments, and click on the new OVERWRITE button at the top of the page. You may need to scroll down to multiple comment pages if you have commented a lot.  

   After doing all of the above, you are welcome to join me on [Voat](https://voat.co/)!"
41,[deleted]
42,"I personally prefer the 6, perfect size, the 5 seems way too tiny to me now. However, I know quite a lot of people that a perfectly happy with their 5 and were angry there was no new similar sized option. Why does everybody have to ""fight"" about what size is good, There is no reason why Apple shouldn't have three sizes and let people chose what fits best. The one size fits all approach has been disproven with the 6 plus"
43,"On other news: Apple leaking to the web to see if people want 4-inch iphones. Yes, please, bring them on."
44,"Good! The 5S is perfect.

Now that I think about it, the improvement will still have to be substantial. Nothing about the 5S makes me want to get a new phone right now."
45,"I just realized ""6s"" sounds like ""success""."
46,[deleted]
47,"Makes sense , would be a good addition for people that sre not keen on a 6"
48,4.7 is really perfect... but the non-screen parts of the phone take up way too much useless space.
49,"A 4,5, and 5.5 is all that's needed, all equally amazing hardware internally. "
50,A friend of mine clings to his 4s as in his opinion this is the form factor ever. I guess that's good news for him.
51,"Ugh. They need some goddamn universal naming conventions. 

Let's see what we can do. And let's pull out device numbers because it just gets muddled anyway. 

---

**Next Year's Line Up If They Knew How To Fucking Name Shit**

---

**iPhone**

- iPhone Mini - 4"" $0
- iPhone - 4.7"" $199
- iPhone Pro - 5.5"" $299

**iPad**

- iPad Mini - 8"" $249
- iPad - 10"" $399
- iPad Pro - 12"" $599

**MacBook**

- MacBook Mini - 12"" $899
- MacBook - 13"" $1199
- MacBook Pro - 15"" $1599



"
52,"I would definitely go back to 4"" after trying the 4.7"" 6.  I just prefer the smaller size more.  It's easier for me to use IMO."
53,This rumor has been coming up since the release of iPhone 6. I hope it's true. I would buy it instantly. I'm unwilling to move from my iPhone 5S. 
54,Take my money 
55,After a month with the 6+ I never want to go back. I don't get the hate for the big size.
56,"have had iPhone's for a while and honestly, i bike a lot, and text. safe as it isn't, i do it all the time, well.. i used to, since the 6 is too rounded for me, thing is delicate AND feels like silk in my hand, with worries of constantly dropping it, i keep it safe more than i would use it. (even with walking, i'll wait a lot to check my phone, maps even.) i would rather a 5s over the 6 only because of the size versus texture of it, "
57,"I'll take a stab before I read the article.  Apple is ""considering"" because there is some demand.  "
58,"Out on the road today I saw a 4S sticker on a Cadillac. A little voice inside my head said ""Don't look back. You can never look back."""
59,A pocket-sized telemaphone?  Will wonders never cease?
60,"While I definitely embraced the larger sizes when the 5 and then 6 came out, not at all surprised that many people disliked it. Having three variations might be a bit cumbersome on the manufacturing end, but I'm sure there's demand."
61,"I have an iPhone 4 running iOS 7, so I am hurting for a new phone right now. however the 6 is too big for me. Torn between shelling out for a 5s or waiting to see if Apple does indeed produce a 4"" phone with Apple Pay built in."
62,Always good to have options! I wish my 6 plus was a bit bigger though... Maybe I should just get an iPad mini lmao
63,"I'd buy it ! but I dont like the sound of the ""mini"" kinda reminds me those cheap ""mini"" version of android flagships like the HTC One mini, LG G3 mini, it's kinda cheap...
could be the iphone air or something like that."
64,6 plus here...love it! Would never go back 
65,"I was surprised they did not do this from the start. They really do need to keep the original crowd in mind. Not everyone wants a big phone, not everyone wants a small phone. Put in the new processor and the new camera and leave the original size. 

As for the name, probably does not matter much. I don't think too many people really care about the name. iPhone classic, iPhone mini, iPhone JMS (just my size), iPhone Kiddie, iPhone SH (small hands), iPhone PF (pocket fit), iPhone phone (vs. tablet)"
66,"I'm glad I held off on the 6 then, because THIS is the one I want. I HAVE an iPad thank you, I don't watch movies on my phone. "
67,"Make the thing the same size and shape of the 5/5s so I can still use my old cases, and use the extra space in the housing for a bigger/longer lasting battery. Seems like a good idea, no?"
68,"Called it. Yes please, that's what I want."
69,This would make a lot of sense
70,I got a 6 and would definitely go back to a 4 inch screen but I love the 128gb too much. I guess a cheaper 4 inch 6c (or whatever it will be) with 128gb wouldn't make sense since the larger storage is for premium users.  Larger is better/faster/more expensive right?
71,I called this about a year ago
72,Well you'll find out in 10 months.
73,"As long as they can keep the specs as similar as possible I think that would be a smart move. 

That would mean that screen resolution, CPU, RAM, storage and camera should be as identical as possible and then have the differentiator be size. "
74,That would be my next phone.  The 5/5s is just perfect size for one hand use and for my pocket.  This is the only reason I am holding off on a new iPhone.
75,"I suspect people that want a smaller form factor will be told to get the watch. *Maybe* we'll see another 4"", but I'm not convinced."
76,Please let this be true.
77,"Hopefully this would take the place of the 16GB model as ""the one we sell for cheap to poor people without letting it eat into our sales of more expensive phones to rich people"""
78,"Oh you mean their game plan all along was to only offer the larger sizes with new design and features this year and then update the smaller model next? Wow crazy, it's like Apple wants people to spend more money or something. 

I just think the wording is funny. ""Considering"" like no doy. "
79,I just miss having the power button on top. 
80,"god this needs to come out like a month before my current plan expires!

I'd love to keep the same size and just upgrade my chipset"
81,"Too many skews. This happened after Jobs left the first time. 
"
82,I love the size of my iPhone 6 plus 
83,"Awesome, I want a phone, not a tablet."
84,iPhone 6s - ?
85,Why do people listen to these stupid ass rumors?
86,iPhone 6 is plenty small and useable in one hand unless you're like Verne Troyer or something.
87,"Please.  The 6 and 6+ are far too big for normal use, and they don't fit in existing accessories."
88,"This is great and all, but I feel like the current spike in iPhone 6 sales is because of the new sizes. I'm sure some people still prefer the smaller size but I don't think the majority do. However, it's good to cover all of their bases releasing the different sizes. "
89,"Words cannot describe how disappointed I am with the 6. I have not found a single improvement that ACTUALLY makes the phone ""good"". Not to mention all the issues that it has.

And I'm coming straight from a 4s."
90,Anything bigger than the iPhone 6 is too big for being a phone.
91,"They had fucking better if they plan on getting my money ever again. I don't want a big, fumbly phone to strain my thumb with. In use my device constantly and have actually had ""mommy thumb"" a condition similar to carpal tunnel from using an oversized android phone."
92,"I like my 6 but I really kind of miss my 5s. It's amazing to think about all the technology packed in to that small package. The 5s has a great camera and still tops most benchmarks, just below the 6 and the 6 plus. "
93,"If Apple is going to offer an iPhone with a 4 inch screen but they aren't going to give it the faster processors of the six then they need to market it as what it is. The 4S Classic.  Not the 6s mini. I know I had three solid years with my 4S that sealed my relationship with Apple. 

It's sort of like when Jeep offered the Cherokee classic. They were able to offer an established product for several more years because of that marketing technique. 

Or like when Coke offered Coke classic. 

My 6+ has a plethora of problems. Shoot I'd be on board with a 4S or a 5S with thumbprint recognition and superfast processors."
94,The normal 6 is perfect sized. This is the biggest waste of time.. while they could be improving the things they already have. Like their terrible OS features. 
95,Uh... no.
96,"I'm curious to know when the phone sizes will start to shift to smaller and smaller, ala a device seen in the movie Her. "
97,Praise the lord!
98,"YESSSSSSSSSSSSSSSS

Always get the S version of iPhones! They refine the technology from the previous models"
99,"Nahhhhhhh.



The normal 6 is plenty small."
100,[deleted]
101,This sounds like an Onion headline
102,"If they were to reduce the side bezels to the thinnest possible, and reduce the top bezel (all space around the speaker and front facing camera) to about half its current size -


.. a 4"" iPhone 6 ""Mini"" could be very, very very small while retaining the 4"" screen."
103,[deleted]
104,"Wait, I thought 3.5"" was ""perfect""?"
105,***
106,"iPhone 6s minus, iPhone 6s, iPhone 6s plus"
107,Yep. Don't plan on buying an iPhone with a different form factor. Unless my hand grows to Groot-like proportions in the next year.
108,"A new low-spec iPhone would cause a world of pain for iOS game developers - we're so happy that the iPhone 4 is finally dead and buried, and we can focus on making games that run well and look great on the 5 and above, with the 4S dropping into 'minimum spec - it'll run but not great' territory..."
109,"They could stick an A8 in an iPhone mini and probably have it perform similarly to an A9-powered 4.7"" iPhone."
110,"That's what I said after my first android... 
  
My 5c is soooo comfy..."
111,"Agreed, it's just the perfect size. Not too big that it's unwieldy going about your day but not too small that not much of your content is shown onscreen/content is shown in too small a size. "
112,"I have a 6 which is already too big for me to use one handed. Tried the 6 Plus in an Apple Store. Man, I wish I'd gone for that one... I don't have a tablet so the 6 Plus would be a perfect middle ground for that. Oh well."
113,[deleted]
114,"I got a 6 recently and I love it too,but I keep my 4s around for a few small things "
115,"I've played with the various sizes of 6. 

I have little hands. My 5s is as big as I can go and still use it one handed. And that's stretching my thumb reach to its limit for stuff in the top corners. They can keep a small option for people with little hands. "
116,The two aren't mutually exclusive. Working on one doesn't take away from the other.
117,the latter should take care of the former
118,Do you really have significant problems with battery drain? The only people I hear complaining about battery life are my Android friends (regardless of age of the phone) or people with iPhones older than 2-3 years. 
119,It's not like their hardware team is also the software team. 
120,I don't know the battery is pretty alright. Gets about a day. Way better than android. Charges pretty fast too 
121,"since upgrading from the 4 to the 6, I've noticed typing on the phone is less accurate."
122,"I was one of the angry ones, not because of the idea of ""best"" but because I wasn't given the option to keep my version of best. 

I HAVE TINY HANDS. THE 6 IS TOO BIG FOR ME TO GRIP."
123,if you have Verizon then having VoLTE is the main reason to switch.....
124,How's your battery life? Because mine sucks and that makes me want to get a new one. 
125,"They'll soon realise folk like me want a 'classic' size iphone and an iPad. 

If the only option in the future is a huge phone, then I'll have that and no ipad.

They're going to have to come up with some pretty good excuses in the future why plus size future models can't be iPad app compatible."
126,If my 5S had NFC I would be set. 
127,"I hope they do come out with a smaller version. It's not as enjoyable or practical to use a phone with 2 hands for me, I like using the 1 hand."
128,"Yeah I have a 5s and don't see any reason to upgrade either. I like the larger screen of the 6 but it's not enough to make me switch. Hoping for a lot of camera improvements on the 6s, that's the only thing that would make me upgrade."
129,Saw a woman in a pizza shop the other day with a 6 Plus making a phone call and she had to use both hands to hold the fucking thing to her face.
130,"yeah the bezels are huuuge.



[Look at the LG G3 compared to the 6 Plus.
](http://i.imgur.com/DbVIpj0.jpg)

Both of them have 5.5"" screens."
131,"iPhone 6s throwback edition 3.5"" "
132,"The 4s was 3.5""

Now that I have a 6+ (Which is perfect BTW and feels totally natural once you get used to it) My 4s feels like a toy phone in my hands."
133,"I actually really like that size for the feel, but the UI no longer supports it well. You can get, like, 1 sms message on the screen with a keyboard up. If that."
134,I'm okay with this.
135,"there's no reason in calling the 6+ ""pro"".

it's the same phone as the 6, jut bigger.

""pro"" is reserved for devices with significant performance improvements."
136,"This should be top fucking comment, at least with names. Prices, I don't care, but I'm seeing a Scully Sugar Water Pepsi Model line up these days with iPad especially. iPad 2 Mini 2, iPad (not 1 but 4) I don't even know.

If I (who posts to the r/appley subs) can't rememberer, pretty damn sure there's some naming confusion.

Need to whittle that shit down, mate.

"
137,[deleted]
138,"That works. It's simple, and to the point. 

I like Mini. Ties into their product line better. "
139,"I like that, too. Would not hurt to get an iPhone Mini for free."
140,They'd cannibalize their high end sales when casual buyers see the smaller phone that looks like an iPhone for much less. Considering this year's sales are so high I don't think they'd do it.
141,Too close to Samsung.
142,"the word ""pro"" is reserved for the MBP because it has significantly more sheer power compared to the normal one. it has nothing to do with sizes.

and if you look at the actual MB lineup, you'll see the air (light and low powered), MB standard for average use and MB PRO for professional use (who ever needs a quad-core to facebook??)

so calling an iPhone 6 PRO or a MB Mini has no sense whatsoever because the iPhone 6 and 6+ has the same processor."
143,"I think it depends on how often the user watches movies, read books and play games. They are what gives 6+ a big edge. But I get how some people think 5s is easier to use, to type with, to handle, and to put into the pocket."
144,"I'd say it's much more a difference in necessity and/or taste than ""hate"".  Do I understand why someone would want a phone that big?  Absolutely..  but personally, I don't want to have to remove my phone from my pocket before I sit down or have to sit my coffee down to type out a Google search."
145,"If you find a deal on a 4S, it could tide you over until the next model. Then you can resell it for not much loss. If you're willing to ""rent"" a phone for about $50 for the better part of a year, that might work well. I did that when my 3GS broke a month before my upgrade window opened. Bought a 3G for $100, sold it awhile later for $80."
146,SKUs
147,How is there too many? There is only 3 and they are all considerably different from one another and appeal to different people. 
148,Um there are currently 3 iPhones. Having them match better wouldn't be a bad thing. 
149,"You realize there would be literally exactly as many but with the trailing ""free"" iPhone maybe possibly having updated internals? 

Doesn't seem like anything to freak out about. "
150,"I have a 6 and I do find it a strain sometimes to reach the full screen. My wrists get sore if I use alien blue, for example, with one hand for very long. 
   "
151,"um so what's wrong with it?  i went from 4s to 6 plus, took a while to get used to the size but now the 4s looks like a kids toy.  6+ has completely replaced my ipad, it's much easier to type on, the battery life is great, the camera is amazing, etc "
152,I haven't noticed anything except its quicker and the home button is obviously way better and works differently.  Other than that the only difference I see is that I had to pick and choose my Cydia apps differently.
153,You're assuming the mini will have a lower resolution AND that the A9 will be clocked the same across all platforms.
154,Out of anger and regret? I would have also.
155,It is.
156,"""minus"" has a bad taste on the tongue.  Marketing wouldn't allow that terminology. But I like how you think"
157,"iPhone 6s Mini, iPhone 6s, iPhone 6s Mega"
158,"I have a 6 plus, I jokingly call my friends' phones 6 minus haha. "
159,"Now just need to kill the ipad 2/iPad Mini. Though that would be kind of a dick move from Apple, given that they are/were selling the Mini less than a year ago."
160,"Low performance would be fine for professionals who don't play games, especially if it also means longer battery life."
161,[deleted]
162,"Yep. Bought a 6 and returned it. 5S feels waaaay better in my hand. Looks better too.

"
163,"You have 30 days to change your mind, fyi

Edit: 14. My bad"
164,[deleted]
165,Yea im going for a 6 plus in a few days. And Im convinced I won't like 4.7s after I get used to it.  
166,[deleted]
