,0
1160,"I built two systems in these when they were $120, they are easy to build in but the psu cables are pretty ridged"
1161,FYI these might take a bit to ship. Ordered mine on the 4th and nothing so far.
1162,"Dam, really want to make an office living room PC build out of this thing"
1163,"Damn when I built my ITX PC 3 years ago I paid $180 just for my SFX PSU


Seems like a great deal lol"
1164,"I have this case and I can say it’s awesome. Cpu thermals are slightly better when it’s on its side as opposed to being vertical whereas gpu doesn’t care.

Otherwise super satisfying build with a 280mm aio in such a small footprint. 

Oh and some people report that the cpu 8-pin cable is too short to reach the eps header on their mobo, I personally had no problems with it but you can route it under the mobo for a bit extra slack!"
1165,Anybody know what the size limit is on GPU's for this case?
1166,"Ordered this, great little case, but my model’s handle mechanism broke immediately so I had to return. Wish it worked out, but ended up going with the NR200 instead

Check Amazon for this as well. They’ll usually have the Adorama store and have better shipping for a couple bucks more"
1167,Damn I just bought the NR200 for the 9.99 price on Amazon. But I still need a PSU. How do the cases compare?
1168,This will my next case soon. No way I can pass on this price with a sfx PSU.
1169,"Bought, no questions asked. I've been WAITING for it to drop lower than 8 months ago when I posted this exact one for $129.99.

Time to start saving up for some components I guess"
1170,"Love this case, have it in white"
1171,"Thanks OP. Picked one up. Went for the black colorway. Used the ""white"" for a friend's kid's build recently and just couldn't jive with the color. It was more of an off-white. It didn't necessarily look bad on its own, but placing it next to any other white case or component really highlighted the color difference."
1172,"Would it be troll to buy this case now for a build I'm planning in the winter in like 5 months? This seems like a pretty cool case, small form factor, handle, fits big gpu, etc, but buying a case and psu months in advance when a better deal might show up or a different case I like more might come around"
1173,"I have an unfinished A4-H2O project in hand and another nr200 plan on the way (yes $10 is an insane price). 

And now I just purchased another one I have no idea what to do with. Cheers."
1174,Unless my address is set to something erroneous shipping says it's 78.45 and starting for me
1175,Tempting to just get a PSU since I ordered that Cooler Master ITX a week ago
1176,If I can find an itx lga 1700 Mobo on sale to actually pair with this I might bite....
1177,"Question for anyone with this case: is it possible to remove the PSU shroud and put a mATX motherboard in this case? At 9.9"" long a 9.6"" mATX motherboard should fit if I rigged up a new mounting plate. The idea would be to fit the components into it kind of like the new [NCASE Freeflow](https://www.caselabs.org/cases/freeflow)."
1178,What about that psu quality? I have been looking for it but cant find the full specs.
1179,Yah I think this is all-time low...been eyeing this case for some time damn you OP
1180,It’s crazy to get a 700W SFX for 109 and getting the case for free.
1181,Well damn... it's hard to even find a decent SFX power supply for this price
1182,This sealed the deal
1183,Yo where do you get this offer?
1184,Was this a targeted email offer?
1185,"Hope yours shipped by now, ordered yesterday got shipping email today"
1186,"I have mine as an htpc. She's a beast, especially with the OLED tv."
1187,https://support.hyte.com/hc/en-us/articles/4405756177428-Will-my-GPU-fit-
1188,335mm
1189,Link??
1190,Damn how did you get it that
1191,"Tough question, you're going to hit Black Friday, Cyber Monday and Christmas even if you don't get it at this price point it won't cost that much more. Personally, I would wait it out if you know for sure you won't complete the build till then."
1192,User name checks out
1193,"I love this case. It was a fun build. The usb-c pass through is annoying and the bottom-I/O is frustrating whenever I need to access it, but after the first few weeks I rarely need to access the bottom I/O."
1194,The SFF enthusiast sacrificed for us to reach this point. Now us plebs can enjoy tight spaces too.
1195,I imagine many small form factor enthusiasts might find it tempting just to buy this to rip the PSU out of it lol
1196,Honestly I'm thinking of upgrading my SFX PSU from 550W to 700W but I may just buy this and swap the PSU's. Although then I'd need to do a second build lol
1197,"It may have been targeted, received the email this morning around 7am central time"
1198,Yep it shipped today too!
1199,would this be 335mm and triple slot? I have a quad slot that measures 335~6 but it's reasonably more thick on the PCI front.
1200,Yeah I think im gonna wait it out. Thanks
1201,I just purchased one for the price with included PSU I will tilt the case as many times as it takes to access the I/O. What cooler are you using in yours?
1202,Giggity?
1203,"Must be, I'm only seeing 2% cashback on Paypal"
1204,"Yup. Triple slot. [Pcpartpicker listing](https://pcpartpicker.com/product/BWmmP6/hyte-revolt-3-mini-itx-tower-case-w700-w-power-supply-cs-hyte-revolt3-bp), [Tom's Hardware build review](https://www.tomshardware.com/reviews/hyte-revolt-3-review)."
1205,Holding inventory sucks a lot. Definitely buy when you need it unless you 100% know you want it
1206,"CoolerMaster ml280 mirror. 280mm AIO. It’s a tight fit, and it took some effort to figure out what direction I could orient it. Got it cheap last year."
1207,"I'm skeptic because there is no drawback communicated aside from the low FOV, so it will probably be a get hype and be disappointed at launch type of deal.No idea about the battery life, can't actually expect it to run applications without a computer at that size, weight and resolution. Not sure if wireless streaming from PC works well.Something about it is gonna be shitty I'm pretty sure, might also be controllers and/or tracking. I don't believe in unicorns."
1208,"200g is incredible light compared to Quest at 500, great for consuming media if not for games...

looks like there are/will be 2 options of the headset:

The **arpara VR** headset weights 200g, 1/3 of a typical VR headset, has 95° FOV and 120Hz refresh rate. It can be connected to phones, computers, and game consoles. Together with a 6DoF position tracking kit completes a PC VR gaming setup.

The **arpara all-in-one VR** headset weights 380g, has inside-out 6DoF head and hand tracking, runs on Qualcomm XR2 platform that is capable of driving 6 concurrent cameras, 11 times AI processing power, supports 8K video. Other specs include a 4600mA high-capacity battery, 95° FOV, 90Hz refresh rate, and support wired and wireless streaming to play Steam VR.

*(from yahoo news)*"
1209,The title is inaccurate. The **tethered** version of it is 200g with 3DOF. The **standalone** version like in the title weight at **380g**.
1210,"I can see formfactor going in this direction. But not yet. There are more important metrics to solve before making it smaller. Like price, battery, fov, varifocal, face/eye/body tracking, resolution, onboarding etc. The list very long.

And if you want to break into the standalone space, you need a store that can compete with Oculus or Steam. Its a HUGE bar to pass. Impossible for most."
1211,"There is nothing ""next generation"" about 95°FOV."
1212,"I don’t think I care at all about this thing being 5k or having good clarity if they are going to make the fov that small in today’s gen of headsets, 95 is just way to small for me, considering what’s advertised is always more than what it actualy can do."
1213,"I love how all people are complaining about the FOV, when this falls right in line with the Quest 2’s FOV."
1214,"95 degree FOV sounds like ass, NGL."
1215,"We need more FOV not less. FOV is one of the most important immersion aspects with current technology, along with good colour reproduction, so the OLED nets them some points."
1216,Form factor is the least important thing I think for a VR headset when the trade offs are so large.
1217,You need a headset that's so comfortable you can sleep in it. Bonus points if the AR features are so good you never have to take it off.
1218,Anything out to compete with the Quest 2 I'll applaud and champion.
1219,Would want a higher FOV
1220,"- Will this be next gen?

Only if they can up that crazy low FOV."
1221,"The form factor is already sufficient. What we need are good lenses. I noticed this when I happened upon my PC while in VR. I was almost shocked at how clear everything looked. I'm on a Quest 1 but it's so blurry in comparison that VR seems only fit for exercise type games where you're not focused on the graphics.

The form factor can stay the same, we needed lenses. The only time I've heard of a veteran VR person getting their mind blown is from better lenses."
1222,I can't go from a 130 degree fov to a 95 degree fov.
1223,I'm more enraptured by the idea of Mechwarrior in VR....*sigh*
1224,"Its missing a headstrap though. Add 100 grams and it'll feel so much better, its not all about mass when talking about how heavy a headset feels. I know this sounds pedantic but if there's no headstrong I'd 100% not buy it, it'll just keep falling down my face unless its super tight

Its like they removed one of the very most important comfort parts so they could say its lighter and let people assume that's more comfortable.."
1225,I'm interested in the reviews. But from my experience with advertised FOV. 95 will likely be obtained by a small few.
1226,"95 degree fov kind of ruins it tbh. 600 dollars to basically have a flat screen in front of your face? terrible deal. for around 200 dollars more you could get 200 degrees fov 8k with the pimax vision 8k plus. on the other hand, i like the lighter weight, definitely a huge step forward."
1227,I heard Apple will come out with their VR and it will be very big end.
1228,"How can I buy this, I need headset to view my vuze xr camera videos"
1229,We will see in 2 years. ..
1230,"The bulk of the Quest 2 comes from the battery and cooling system. It could be slightly smaller if they didn't use LCD panels, but not by much. I'm just going to go out and say it, this standalone version will never exist as a consumer product."
1231,Yes it will and can't come soon enough. Same for microled monitors instead of miniled or backlit cruft.
1232," is this ""Pimax"" all over again?"
1233,I don't think so.
1234,I mean… I’ll believe it when I see it
1235,Their prototype hands-on videos lack the 4 tracking cameras shown in promotional images. Wouldn't be surprised if it's all vaporware and is just a cheap personal 3D viewer with a 3D-printed shell.
1236,"Definitely skeptical, but if it does actually lack a top headstrap, and is comfortable, that's a big plus for me.  Not enough of a draw though if the experience isn't as good."
1237,Yikes that looks extremely uncomfortable
1238,"More importantly, can I use it with the Facebook spy machine?"
1239,I'm ready for one of these tiny headsets.  F cumbersome VR.
1240,That FOV though.
1241,i picked up my phone today and weighed it. it was 200g. Damn
1242,"hopefully the compactness doesn't negatively impact performance. i'm looking forward to more reviews of this, then i'll cop it in time for my most anticipated game."
1243,Im looking forward to the all in one version with 6 cameras.  This will be my first VR
1244,"Not to mention the store. If it’s standalone it’ll have its own store, which will probably be limited."
1245,"This device will be half baked and suck, imo, *but* it's a great insight into microLED tech and where it will allow VR to go so I'm still excited to see it but I have no intentions of buying this specific device."
1246,"Battery is probably in the back of the head trap like the Neo 2/3 Pro have

The main drawback on basically any standalone is going to be shitty software though, both the user experience and the tracking quality"
1247,[removed]
1248,"The reviews will be very interesting for sure. Quest 2 is not particularly good at PCVR, so it will be interesting to see how new headsets compete with it, especially for wireless. So many people are itching to ditch Facebook as soon as a viable alternative appears. If its not a lemon, I could see this being a decent Quest 2 competitor with the form factor being a big upside for certain people. It is a hard sell though especially with the true next gen of VR on the horizon."
1249,"In comparison, the Valve Index is 809 grams (and IMO less comfortable due to this than the OG Oculus Rift) and the HP G2 is 500 grams. 

200 grams would be a complete game changer."
1250,"> 11 times AI processing power

What is this?"
1251,200g is less than my xiaomi phone
1252,120hz is only for 1080 resolution according to their site.
1253,True. but at least the compute unit and battery are in the back. the Quest 2 is 510 g ALL in the front. This will be 200g in the front
1254,"Actually often times the shrinking process that brings the cost efficiencies because it usually relies on highly engineered, highly specific components that may be fairly easy to mass produce.  With mass production comes cost savings.  Just because we've seen cool technologies doesn't mean they are the future.  People need to stop thinking that the next product MUST have this or its garbage.  The next product will be the one the masses are impressed enough with to buy, that may not be very impressive to you."
1255,"I guess it has micro OLED displays and 95degree FOV.

No idea how it tracks."
1256,"I heavily disagree. Some people (like myself) cant play VR anymore because of neck pain. All those other issues you listed are trivial compared to that (except maybe the store, but they can always hook up to Steam)"
1257,"Any standalone can just use steam, that's not a problem. The reason Oculus has their own store is mainly because Facebook want all the data for themselves as the Quest is primarily a data gathering device. But you can use Steam for Quest 2 with wireless PCVR."
1258,The oculus store is low key crap
1259,I think we will see another headset in roughly this form factor on the 28th of October.
1260,"None of that is mutually exclusive though. What will actually happen is each VR headset company is going to have their niche. So, some companies will focus on this smaller form factor, some on fov, some on lenses, some on displays, so on. These will all be band wagon type companies too, with low overhead. A business can be made like this, it just won't be the market leader. These companies know and accept this as part of their business plan.

To be the leader in tech, or life in general, you need to be doing stuff your competition can't. Developing new technology is the way to do it, most of the time. What VR company is doing research at the level of Facebook? None that I know. Valve to some degree."
1261,"> I can see formfactor going in this direction. But not yet. There are more important metrics to solve before making it smaller. Like price, battery, fov, varifocal, face/eye/body tracking, resolution, onboarding etc. The list very long.

Not all of those have anything to do with the weight of the unit. Battery of course, FOV and varifocal likely depending on the solution, resolution though not at all. Price doesn't need to be higher and more tracking sensors don't necessarily will increase the weight noticeably.

> And if you want to break into the standalone space, you need a store that can compete with Oculus or Steam. Its a HUGE bar to pass. Impossible for most.

To be fair, this seems at least compatible with Steam VR when coupled with a PC."
1262,"Steam doesn't have a standalone headset in any shape or form though, does it? 

However when the wired version of this is compared to the index it has some truly massive upgrades.

I don't really agree with the sentiment of what your going for, and I find it worth pointing out this is a Chinese headset, and is also meant to compete in a completely different ecosystem, the fact that steam VR is supported in and of itself is a very big deal. 

Also all of those major features you've described don't even exist in 95% of available headsets, it sounds like your trying to shoot the arpara in the foot based on competition that doesn't even exist yet."
1263,"True, I would also prefer improvements in those other aspects, but there are already many other companies working on that and I don't think it's a zero-sum game. I think it's natural that as VR grows we should expect headsets to further diversify to cover a variety of needs and interests, from lower fidelity but sleek, portable goggles, to bulky but photo-realistic super-haptic powerhouses. I remain skeptical of what this specific headset can deliver but I think it's a good sign for VR as a whole."
1264,"Standard VR displays are usually 2-3"" but microdisplays typically are around 1"" making it harder to get a wide FOV.  Need to employ some lens trickery to get bigger FOVs or make larger displays"
1265,Maybe playing Beat Saber at half the weight is more next gen to some people than wearing a giant headset with a wide FOV.
1266,"A person who knows exactly what he or she is writing, unlike others. Thx."
1267,Its because of their religion to FB. Quest 2 cons only exist for other HMDs.
1268,"Index has 108 degrees and everyone was raving how big it was. Both CV1 and Rift S had 88, so 95 while not ideal is definitely not ass, especially from a tiny device."
1269,That's what I've been saying all along.  The Quest 2's FOV sounds like ass.  Haven't tried it though.  Might be worth it if it were in a form factor that matters.
1270,"I don't agree cause most headsets right now (especially the high FOV focused Pimax) don't really benefit from large FOV. Not only that it costs more GPU performance, the small sweet spot and fairly bad e2e clarity of fresnel lens makes it fairly useless. If I can't really look around properly with my eyes but only having a good picture in the middle and need to use my head for looking around, a bigger FOV wouldn't help me much. Combined with better lenses I agree with you though."
1271,"Same. Couldn't care less. I want resolution/clear images. 

I haven't tried a current gen VR headset that felt ""too heavy""."
1272,[deleted]
1273,"Form factor will be what allows a VR headset to become a work product. At that point, it will be much more valuable, than simply a consumption device. Like the difference between a tablet, and a laptop.

Friction is the most important though. Taking out your brick cell phone from your back pack, versus the one that can fit in your pocket is a big deal.

I want many things from a VR headset, and right now, the thing that keeps me from using it the most is form factor.

Sure, I am willing to put up with a brick on my face to play Beat Saber, but what about everything else? 

We will have to see if this form factor is good enough for long periods of work, or if it needs to be smaller still.

And I am saying this all in the context of the average consumers. Not us early adopters. We will put up with a lot. Shit, I had a Pimax 8kx for a bit, because of the specs only. Ergonomics were out the window."
1274,what tradeoffs? price?
1275,"100% agreed.

The VR-3‘s aspherical lenses are mindblowing and brought the biggest jump in immersion I have felt since the OG Vive."
1276,"At this point, I’d bet that ‘needing straps’ is a bigger barrier to mass market adoption than any graphical innovation."
1277,Same reason why I won't buy any headset with fresnel lenses anymore. Pancake is the minimum I'm ready to accept as of now for an upgrade.
1278,G2 has good lenses. But I'm really just hoping that Varjo make an affordable consumer version of their headset. Seems to look close to reality.
1279,"The lenses are Oculus and Valve headsets are the only ones that are clear to the edges (relatively speaking).

The reason the Quest 1 looks terrible is because of the low resolution OLED displays. Try a Quest 2, and it is night and day difference.

Blurry is the wrong way to describe it. Unless your IPD does not fit the Quest 1. Then it WOULD be blurry. Otherwise, the lenses are pretty damn sharp on the Quest 1 (relatively speaking. I have to say that because, no lens is perfect). But, the Oculus line of products, and Valve, are the only companies with lenses that are clear to the edges."
1280,[deleted]
1281,valve index is not 130 degree imo. I have both a Pimax 8kx and a Valve Index..I measure about 110 horizontal on the index with eye relief all the way in. It's an improvement over the Quest 2 but not that drastic. A headset with a weight of 200g at quest 2 fov is intriguing. I'd love it if it was 200g and 20 more degrees fov
1282,"Thats Mechwarrior online, does it even support VR in any way shape or form lol"
1283,"There is a leaked image of a Quest Pro floating around (Could easily be fake), It has a similar form factor and no top head strap.  I think the new design might allow for new types of head straps and overall ergonomics ."
1284,"You forgot the optics. Here is a size comparison between pancake vs fresnel lens module.

https://i.redd.it/i91hkvwqs6x71.jpg"
1285,they are two different VR Headset
1286,isn't about the same FOV of Quest 2?
1287,"there's two versions iirc, standalone and pcvr"
1288,micro OLED != microLED. Two different display technologies.
1289,"I think that it would be much better than the quest if they allow for more customization and don't hide user installed apps under a separate tab, of course then if you own a quest you could use an apk extractor app to pull apps from you quest and put them on the arpara, so having this headset might not be so bad, as long as you can get quest software using the method I said."
1290,"it will be worse. Quest 2 diagonal FOV is around 110 degrees. Marketing is always about diagonal FOV, always."
1291,"> Quest 2 is not particularly good at PCVR

Care to elaborate?"
1292,"Huh, when I have my index strapped on right I barely notice the weight. Way more comfortable than other headsets I've tried"
1293,"*According to the chipmaker, Snapdragon XR2 offers twice the CPU and GPU performance of the 835, over 11 times faster AI processing...*

*(from Venture Beat)*"
1294,"Putting battery and compute unit in the back is a great idea, I'm glad someone is finally doing it. Well worth the additional cost.

I don't know if I can buy a new HMD with a 95° FOV though."
1295,"It has cameras, inside out tracking like wmr/quest headsets"
1296,"Yeah, but software. Where? What? How?
Hardware checks are great, but its not the foundation for success. 

The VR graveyard is filled to capacity with companies who didnt understand that.

Until Steam become the standalone 3rd party VR app store, I dont see much changing. We all (almost) hope for that."
1297,Most steam games won't run on standalone VR
1298,"\[Citation Needed\] on ""the Quest is primarily a data gathering device"". I want to hear what ""data"" it collects on uses. And actually gathers, not some vague ""It's Facebook"", actual concrete evidence from network observation.

Oh, and preferably it should not be same data that Steam constantly collects on me."
1299,"If a standalone uses Steam/PC, it’s clearly no longer standalone. You’d need a SteamOS with ARM support and library of ARM games (or Apple-esque x86 translation)."
1300,Any standalone can use Steam… if Steam adds support for standalone and gets some standalone games. I cant see it happening before Deckard comes out.
1301,But going with bigger displays means more weight as i have an android 4k Phillips tv that's over 20 inches now todays displays aren't as heavy as an old crt display but that's still pretty heavy just imagine how much the quest 2 would weigh if it were made in the 90's or 2000's
1302,"Indeed, people don't see the big picture here. They're all arguing from the standpoint of an enthusiast or existing VR user, probably PC VR user. But the reality is that people don't think like enthusiasts, and an industry doesn't go mainstream by catering only to enthusiasts. People who don't have VR or never tried it won't even know what ""a new amazing headset with 140 degree FOV!"" means in practice. Meanwhile, they can immediately tell when a headset looks big and uncomfortable, and that will deter them from even giving VR a chance."
1303,"I think you have to differentiate. For people who don't have a Quest or another VR headset within 90-100 FOV range, this might be a reasonable option to consider.

Owners of similar FOV headsets have a right to complain though cause most of us want a significant upgrade in FOV. Preferably to a point where you don't have the goggles effect. Quest owners also would give up access to already bought games/apps.

Even if you don't mind the FOV there are lots of other factors which are big question marks at this point. Software, performance, tracking, UI, store/apps, (wireless) PCVR support,  ...

If any of the mentioned points doesn't reach a certain quality level you'd expect from a VR headset today, then it will have a hard time gaining market shares. Especially if the competion rises. Valve, Facebook, Sony, ... they all seemingly plan to release new hardware in the next 3-12 months."
1304,"This is marketing not measured, though, so it's probably diagonal. Rift S was marketed at 95. Arpara is probably similar to Rift S or worse, only years later on a ""next-gen"" device. Which is fine; they're going for small size at the expense of FOV, but personally I don't like that trade-off."
