,0
1396,">So, tell me where in Oculus Privacy Policy it says ""Quest is primarly data gathering device"".

98% of Facebook's revenue is ad-related from data gathered. Data gathered from Oculus use is fully integrated into this system. You have no questions whatsoever as to why a data driven ad company choose to buy a VR-gaming company and sell hardware at a very low price, and that's fine, but you also refuse to read the answers they give themselves. 

>All you have done is cherry pick a word from larger policy text and then pretend that is all there is.

A word? Actually it's several words. And the words happen to be ""all the data we gather from your Oculus use is integrated with all other Facebook products and used for research, selling ads and ""social good"""" And I ""cherry picked"" that sentence since that is the sentence that clearly and irrefutably proved you are completely wrong about the data only being used for VR and that Facebook VR is somehow separate from the rest of Facebook.

>Hell, even now you insist that business of Quest is to collect data for ads!

Of course it is, just as Messenger and Instagram do. Because data is 98% of their revenue and their entire business model revolves around it. There is nothing on Facebook separate from gathering data for ad products. Why are you still stuck thinking that Oculus is on some magical private island paradise separated from the rest of Facebook and they're just saying no to unique and highly valuable data which they have your permission to gather and use? Even after they explicitly tell you that they are gathering data for ads from your Oculus use?

>Fundamentally, yes. I don't pretend that just because Valve sends me ""recomendations"" that they are not ads. 

With that definition every company on earth is the same. So that's just silly. And Facebook aren't sending you ads. Facebook is creating ad plattforms from your data so that other companies show you targeted ads.

>I don't need to be a hypocrite to realize that Valve is trying to get me to buy shit from them.

You're not ""buying shit"" from Facebook. Ad agencies buy shit from Facebook. 

>Again, this is like you claiming that only way McDonalds makes money is via selling hamburgers made out of cow. They do sell those, but they are not their only way of making money.

If 98% of McDonalds revenue was from hamburgers, that would be practically the only way they make money. Trying to argue against that is so futile I don't understand why you're even trying.

>You think that Facebook selling adspaces for others to try to sell you products is magically different from Valve doing it themselves.

I don't ""think"" that, I am stating clearly and factually those are two fundamentally different things. Every company shows ads, every media company has recommendation algorithms. Facebook builds an extensive and detailed profile on you and all your friends and family, and your relationship with them, in order to create platforms for companies to buy ads on. That is completely different and you know it, no reason to be obstinate about such an obvious thing.

>You then proceed to act as if Facebook producing a VR device was made to show ads and ""collect data"",

Yes, Facebook is an ad company. They didn't pay huge amounts of money to buy the primary VR company just because they love to see you having fun, or are desperate for a tiny tiny revenue stream of games. And I haven't even mentioned ads being shown in the Oculus app, that is a tiny market and not of big interest at all, the ads are shown in your browser. Incidentally though, Facebook are also opening up more possibilities to show ads on Oculus too

https://www.oculus.com/blog/testing-in-headset-vr-ads/

But again that's insignificant compared to the value of your data for regular ads.

> You can't even show actual difference in the data collected, all you can do is say ""BUT FACEBOOK!""

Why are you still stuck on what data is collected? I've already explained to you very clearly how their methods of collecting data are vastly different and serve completely different purposes. And  I've already explained to you that what matters is how the data is stored and used, which I've also shown you is vastly different between Facebook and Valve. Many many times. 

Is this ever going to sink in? Your still stuck on ""BUT FACEBOOK"" even after I clearly and in detail explained to you how they work and create revenue, and I haven't even said if I think it's bad or good. You have some kind of idea in your head that I'm critizing Facebook and you're defending it. Drop that idea, that's not what's happening. I'm explaining how Facebook makes money, specifically how they use Oculus to make money, and you're refusing to listen because you feel like I'm attacking Facebook by explaining how they create revenue. You didn't even know they were explicitly an ad company and you still keep going..."
1397,"And again, you can't actually show anything. All you can do is say ""Facebook is ad company!""

It's pretty clear all you got is conspiracy theories. Not actual evidence. You can't show actual concrete evidence, all you can say is ""Facebook!"" You can't even show the supposed data that is collected (that would be in anyway be different from every other headset)"
1398,"I literally just disproved every point there in the comment you're replying to. So you're not even reading my comments at all anymore. I'm just gonna go ahead and reply to you with the Facebook policy from now on.

>How do we use this information?"", including to provide, personalise and improve the Facebook Products (including seamless integration between the Facebook Products); to provide measurement, analytics and other business services (including ads); to promote safety, integrity and security; to communicate with you; and to research and innovate for social good"
1399,"No you didn't. All you said was ""Facebook is ad company, therefore everything they is to collect data for ads"".

You are being the moron who insist that if McDonalds offers chicken sandwhich, it must be made out of beef because their hamburgers are."
1400,"I insist that if McDonalds is telling you that their chicken sandwich is made out of beef, maybe you shouldn't insist on being obstinate and pretending as if you can't hear them.

I said Facebook is a data driven ad company, and then I showed you a paragraph where they explain that they use your unique and personalized data from VR as a part of their entire bussines model

>How do we use this information?"", including to provide, personalise and improve the Facebook Products (including seamless integration between the Facebook Products); to provide measurement, analytics and other business services (including ads); to promote safety, integrity and security; to communicate with you; and to research and innovate for social good"
1401,"And again: Facebook never said that their headset is primarly data gathering device. That is your little invention from seeing one word in the entire privacy agreement, ignoring rest of it and the fact that ""ads"" in this context refer to content recomendations."
1402,">How do we use this information?"", including to provide, personalise and improve the Facebook Products (including seamless integration between the Facebook Products); to provide measurement, analytics and other business services (including ads); to promote safety, integrity and security; to communicate with you; and to research and innovate for social good

Reminder: Facebook is solely a data based ad company. 98%of $86 billion."
1403,"Ah yes, ""solely data based ad company"". That is why they have *every other revenue source*. Like selling headsets and apps. Clearly these are just ""ads"". I didn't buy a headset, I bought an ad!

Like I said. You are person who thinks only source of revenue of McDonalds are hamburgers, because you can not grasp complicated concept of ""Company can generate revenue more than one way""."
1404,"Aw, you already forgot that 98% of their 86 billion dollar revenue is ads, and that they make next to zero or possibly even take a loss on their VR-headsets? Well, here's your reminder."
1405,"Ah yes, because field they just entered should totally dwarf the field they started in.

Furthermore, the fact that VR is growing part of their revenue is evidence that your claim them being ""solely ad company"" is bunk.

Or do you not understand meaning of the words you use?"
1406,"Yes, VR increases their ad revenue and gives them huge potential to get ahead of the competition in that area with more unique and accurate data. And the competition is in no way Valve. It's Google (mainly YouTube), Apple, Tiktok, Snapchat and other major players. You think Facebook is spending billions on VR just because they think it's fun and exciting, which is cute, but also retarded. 

Hey, it seems at least you've at last understood that the data they gather in VR is in no way separate from their other data on you. Progress!"
1407,"There is no ""accurate data"" they can get from the headset that actually helps them to sell adspace. You are doing nothing but revealing how *little* you know about how Facebooks ad system operates.

No, Facebook is not putting money into VR because it's ""fun and exciting"", but they are also not spending billions of dollars to sell headsets at price that they will never recover via ads. Their goal is to become dominant force in the emerging market, since they missed the smartphone emergence and now have to bow to Google and Apple.

Let me ask you, do you also think that your phone is ""primarly data gathering device"" too, since Googles primary revenue source is ads?

Money Facebook gets from ads per single user is roughly 15 dollars per year. In contrast, VR users spend 50 to 100 dollars a year. 

Your incapability to understand concept of ""diversification"" and that companies can have more than one revenue stream shows how narrow minded you are. 

Tell me, if Quest 2 is ""primarly data gathering device"" (AKA *spy device*), where is all the network activity where they send all this data? There isn't. Only thing you have is *one instance* of them mentioning word ""ads"" in the policy and you are so fixated on that you miss the forest for the trees.

But fine, I let you ""go"", you can take your ""NO! IT MUST BE ADS! I CAN NOT COMPREHEND MORE COMPLEX THOUGHTS!"" idea and wallow in it."
1408,">There is no ""accurate data"" they can get from the headset that actually helps them to sell adspace. 

When you play games, how you play games, your proficiency in games, who you play games with, what type of games you prefer, for how long you play certain games, how likely you are to give up on a challenge, when you stop playing games, who you play games with, who's in your home when you play games, anything that can be measured with an achievement etc. etc. there is TONS of unique data.

>Let me ask you, do you also think that your phone is ""primarly data gathering device""

Regarding Facebook and Google? Are you fucking joking? You don't even think Facebook sees your phone as primarily a data gathering device!? Holy shit of course it is, they are facing serious problems now that Apple wants to keep iPhone data for itself. Oh my god you are really clueless.

>Money Facebook gets from ads per single user is roughly 15 dollars per year. In contrast, VR users spend 50 to 100 dollars a year. 

Hahaha that is one of the most desperate manipulations of data I've probably ever seen. Holy shit that was funny. Didn't you feel disgusted by yourself by trying to average Facebook's income from all it's inactive users a few years ago and then compare to *spending* of the average VR user today? Hahaha Jesus you're so desperate. First of all, your first desperate stat actually **MORE THAN TEN TIMES HIGHER THAN WHAT YOU STATED** for north America https://www.statista.com/statistics/251328/facebooks-average-revenue-per-user-by-region/ 
**AROUND $165 PER USER FOR LAST YEAR.**

Then you compare it to ""spending"", which is ridiculous. So anyway, you got caught in your disgustingly retarded li'l lie. What have you got to say for yourself, and how did you feel when you had to desperately resort to lying when trying to defend your position? Dont you feel dirty for trying to pull that stunt?

>Only thing you have is one instance of them mentioning word ""ads"" in the policy

Why the fuck would they mention it twice? It's perfectly clear as it is. And it's in the context of how they gather your data and integrate with your other usage in order to make more than $165 out of you per year.

>Your incapability to understand concept of ""diversification""

Yeah sure, that's cute. ""We're in a desperate competition for data, and it's our entire business model, but do you know what would be fun? Risking a huge loss in a completely separate area unrelated to what we do! If we succeed and beat the competitors there we can make way way less money than what we're making in our current market!""... this fantasy of yours is clearly disproven already.

Anyway. Now I know your a liar who's prepared to make up desperate and crazy lies to try to back up your fantasy. So, no use to continue since you'll just make up anything and don't give a shit about facts. Byeee."
1409,">When you play games, how you play games, your proficiency in games, who you play games with, what type of games you prefer, for how long you play certain games, how likely you are to give up on a challenge, when you stop playing games, who you play games with, who's in your home when you play games, anything that can be measured with an achievement etc. etc. there is TONS of unique data.

Literally same thing that Steam collects. This is data they use for exact same purposes as Steam.

But like said: you can't comprehend business. All you can see is one thing, so that one thing *must* be the only thing."
1410,"Fuck off now desperate liar.

Edit:
>Literally same thing that Steam collects. This is data they use for exact same purposes as Steam

So fitting that you finished everything off with another complete lie. Bye."
1411,"[https://store.steampowered.com/privacy\_agreement/](https://store.steampowered.com/privacy_agreement/)

&#x200B;

>3.5 Your Use of Games and other Subscriptions  
>  
>In order to provide you with services, we need to collect, store and use various information about your activity in our Content and Services. ""Content-Related Information"" includes your Steam ID, as well as what is usually referred to as ""game statistics"". **By game statistics we mean information about your games' preferences, progress in the games, playtime, as well as information about the device you are using, including what operating system you are using, device settings, unique device identifiers, and crash data.**

But of course, you don't count these because you think Steam (and by extension, Valve) care about *you* as a person."
1412,"How strange that it's way way less data than Facebook there, and no mention of integrating it with the gigantic money making social media conglomerate of Steam subsidiaries to make $165 a year of this data on you alone. They must of forgot that part... fuck off now liar."
1413,"No, it's literally exact same data. What you play, when you play, with who you play, how long you play, what achievements you have achieved, when you stop, when you start.

But you saw one instance of word ""ads"" being used, so you pretend these are magically different. All you have is whataboutism and moving of the goalpost. You still haven't actually shown any evidence of the original claim, just ""look, they used word ad in this sentence"" and then going about ""what about Facebooks *other* services?""

Must be nice seeing world as black and white."
1414,>and no mention of integrating it with the gigantic money making social media conglomerate of Steam subsidiaries to make $165 a year of this data on you alone. They must of forgot that part... fuck off now liar.
1415,"I’m going to use my mini for as long as I can. I imagine they’ll bring it back by the time I need a new phone. For about 2 days I was thinking it was too small, and then all of the sudden it felt so right… it even started to feel like a normal “large” phone. And now anytime I get a normal iPhone in my hands I am borderline disgusted by how big it is. They are far too much for me and I have no interest in ever going back to that size."
1416,"I use a 13 mini as a secondary line. I love the form factor too. The only downside is if you are a power user, the battery may not last a day.

Other than that, it serves me well."
1417,All three of my kids have the 12 Mini and every time I help them troubleshoot something I’m reminded of how freeing a small phone can be.
1418,"I loved my 12 mini but the battery life drove me nuts. Just got a 14 Pro, and while I love some of the features, I’m disappointed they didn’t make a 14 mini"
1419,"I moved from Android to IPhone specifically for the 12 mini. I was tired of big phones that popped out of my pocket, or felt uncomfortable if I bent over. The Zenphone 9 wasn’t out in Canada at the time so after some searching around I wandered into an Apple Store for the first time and tried out the mini. I miss a lot about Android, but this form factor is great for an everyday phone. 

It’s important to note that aside from some emails/Reddit and messaging, I don’t use my phone for gaming or serious work. It’s a good for photos, but when we go out someplace I still pack the DSLR.

Edit:more info."
1420,"I love the size of my Mini 12, hate the battery life and it has other issues if overheating and screen dimming, but I can’t give it up because the size is so perfect. My wife has a 14 pro max and it is just impossible to hold comfortably. The perfect combo is iPad mini + iPhone mini"
1421,"It’s the best phone in the world no arguments.

I feel like I can scientifically prove it too - I have regular sized hands and I cannot reach the top left of the screen to pull down the Notification Centre without readjusting my grip.

Therefore anything bigger than that is a waste except for media viewing.

All imo.

Oh and it fits in the band BEAUTIFULLY. And the pocket - you hardly know it’s there unlike some android monstrosities that are pulling your jeans down to your ankles."
1422,"Love my 13 mini. Absolutely perfect size — to be honest, now that’s I’m used to it I could go even smaller, something the reduced bezels of the upcoming generation would allow for. If only the kept this screen size!!!"
1423,"Form factor is godly good. It's just text on the phone is harder to read. Typing with smaller keys and just overall media consumption won't give you that wow factor. But size is amazing. 

Great phone for activities or just on the go and need to carry light"
1424,Love the mini form factor. Had the 12 mini and upgraded to the 13 mini in December. Hope Apple bring backs the mini for future models. Even with aging eyes I still prefer the smaller form factor.
1425,"I downgraded from the 14PM to the 13 mini, and I don’t regret it all. Form factor is goated."
1426,I feel so validated I'm not a phone addict as I'm rocking a 12 mini and have 50% battery at the end of the day. (weird flex but ok :)  My laptop addiction OTOH...
1427,"If only the sales were as good, as the handful of Reddit users are vocal about the 13 mini...."
1428,Fitted with the pro's camera would be just perfect!
1429,"I returned mine. I was excited for the easy one handed operation, but in reality it’s so hard to type on, watching videos is too small, and the battery sucks. The max is too big, but the 6.1” model is a perfect balance of it all for me, can still use it with one hand pretty easily and videos are big and battery is great."
1430,[deleted]
1431,Still rocking my 12 mini with no plans to change any time soon.
1432,Loved my 12 mini but the battery SUCKED
1433,I had the iPhone 13 base model and simply found it way too small for my usage and therefore got the pro Max! I use it as a media player in the car and the base model was simply way too small for me. All about personal preference.
1434,"Went from 13 Pro Max to 13 Mini. Such a good decision! Using it is so easy and I don’t fear of dropping it and my hands don’t get sore from holding it too long. Battery life is trash tho, that’s why I carry a Magsafe Battery Pack in my backpack. I only put it when I know I’ll be out for a while."
1435,I’m still using my SE 2 and it’s started getting comments from people amazed at the size. Dreading when I have to replace it.
1436,"My only issue with the iPhone 13 Mini is that the default UI (not just the text size) is too small, and somewhat smaller than the UI on the iPhone 5S and iPhone 8/SE 2020/2022 which sucks.

Yes, I know Display Zoom exists and it DOES make everything much easier to use with one hand, however the UI is too big. There’s simply no option for making the UI and text just a tad bit bigger, but not too big.

That’s my only gripe with the iPhone 13 Mini. Everything else is fine. It’s a good size, but drawbacks like that is the reason why I got the iPhone SE 2022 instead. The default UI and text size is much better and it is just easier to use with one hand. Not to mention the control center on the iPhone SE comes from the bottom and not the top right corner.

If only Apple actually made the UI much more optimized for the Mini sized screen."
1437,"My hope is that once they revise the iPhone SE in 2024. It will be produced with body of the iPhone 13 mini, like they did with the iPhone 8 , as the SE always had to be „a step down“ from the normal iPhone. Also the SE had the smallest screen. I know so many people who are mad at Apple for discontinuing the 13 mini."
1438,I’m still rocking a 12 mini and love the form factor
1439,"Welcome to the mini gang. It seems there aren’t that many of us as Apple decided to shit on us after just 2 cycles of products. I’m not going to buy another iPhone until I can’t get another one that’s similar in size. They have to

Can’t really hold any big phone in my hand after this. Perfect size"
1440,"I’ve just changed from a 12 mini to the iPhone 14 Pro Max (I was used to the size as before the PM I had an S10+.). I loved the size of the 12 mini but the battery was awful and a real let down and in recent years, I’ve started watching more YouTube so the small screen just wasn’t cutting it."
1441,i have a 14 pro max (ik pretty far out) and held a 13 mini the other day it was actually REALLY. i like little phones. but at the same time i love big ass phones
1442,"Yep. I just switched from a 12 Pro Max to 13 mini a couple months ago.  My work phone is a standard 12 and suddenly feels HUGE and actually uncomfortable. I ca t believe I went for 2 whole years with a phone even bigger than that.

Having said that, the battery life does kinda suck. But I picked up an iPad mini 6 around the same time and that does all of the big screen and big battery things for me."
1443,"I to really like my 12 mini, a perfectly sized pocket smartphone with good cameras, screen and processor.

Also, why are you guys all watching videos on your phone, don’t you have a tablet?"
1444,Eyes are more important than hands....the bigger the better.
1445,"Yeah, hope the 15 will have mini size."
1446,"the perfect smartphone size^* ^for ^me

As much as I love small phones, the broad generalization that smaller is best doesn't ring true for everyone.  Hell, that's why we're in this mess in the first place because marketing folks thought we only need one phone size to rule them all and allowed big phones to take over the world.

Phone size is an ergonomic factor and we all deserve choice in this regard."
1447,"I've been holding onto my iPhone SE1 since 2018. And this phone is mostly perfect in every way. Fits perfectly in the hand (and pockets), has 128GB storage, a 4K camera, Touch ID, LTE, GPS, a headphone jack, a hotspot, Apply Pay, WiFi Calling, and you can single-handedly touch the opposite corner of the phone without having to awkwardly reposition the phone in your hand (crazy, I know). As far as I can tell, it is literally one of the most practical phones that have ever been made. The only problem now is that the battery life is declining and the 2GB RAM is starting to become noticeably slow. And I have also been noticing evidence of potential microphone quality throttling specifically during phone calls, which is the main purpose of a phone. The microphone quality is amazing in videos and voice recordings. So it might be software throttling to push people to buy a new phone. The main reason I have not upgraded my phone is because Apple and Android manufacturers have yet to make a phone like it. I would settle with the 13 mini if it had a fingerprint sensor, and even be willing to be extra for it, because no one makes a phone like the iPhone SE1 anymore. Apple completely did away with the mini line thinking that nobody wants a smaller phone. I think what's more likely the case is that people who are practically minded may go for a smaller phone and are also less likely to upgrade their phone every year. Also, some of us don't care for Face ID and love Touch ID. The iPhone SE1 is so perfect besides maybe the bezels (which I can deal with), RAM, and battery life. On modern phones, you can't even single-handedly reach your thumb to the opposite corner without awkwardly repositioning the phone in your hand. How is that convenient and how are people dealing with it? I don't get it. I want a phone, not a tablet... LOL. Phone sizes and car designs are really perplexing these days, among other things. It feels like the world is going backwards."
