,0
639,"No, I can truly go as high as 5k$, I mentioned that the budget is very flexible. I was just wondering if there was some corner of the market that was completely evading my radar, but this thread is slowly showing me that there ain't.

Sorry if I seemed antagonistic. Thanks for the advices!"
640,"It is removable, we just happen to like using a power bank with it as it's easier and don't have to stop recording to change batteries, just plug it in and keep chugging on - (use it as a main cam for YT channel) and that thing gotta say it's TOUGH.  


It's been soaked in transmission oil, engine oil, sees winds up to 60mph, works in plain sun, also recording cars on dynamometers with ambient temps reaching 45-50C and a few weeks ago it got rain on... still going on strong."
641,"It doesn’t have really bad over heating problems like the rx100 line has when shooting video, 4k specifically. That’s the biggest thing."
642,"100%. Besides action cams, nothing is as good as a phone right now. And those tend to suffer in low light. In bright scenes, however, they are great with some unique features (GoPro 10)."
643,if you want higher quality you lose pocketability because of this inconvenient thing caled physics
644,"Gopro has never really had good low light, but that said, the 9 does _decent_ in a lit city environment, street lights + shops, that sort of thing. Once you go off the main streets it's unusable. 10 allegedly improves on this a bit, but I don't have one so can't speak to that. 

The 7 Black is _obviously_ worse in daytime regular footage, you can find samples online if you want to see what you can pull out of them. No idea about low light specifically though, but it's not gonna be better.

EDIT: when I say find samples, I mean fairly specifically gradeable, shot in Flat profile, High bitrate setting stuff. There's a lot of idiots out there comparing the Gopro native colour profiles across generations, which is obviously completely pointless. 9 also adds HEVC as an encoding option, not sure about 8, which then makes the files more manageable, but the big sensor jump was 7 to 8, 8 to 9 is mostly a CPU change, faster readout etc."
645,The mk vi and vii don’t either. I’ll grant you the iv and v do. (I have a iv and a vii)
646,Starting to realize that. IPhone it is. 🤷‍♂️
647,"Ah I see, then I guess it’s on par video capabilities for hundreds of dollars less."
648,"Be mindful of listings from suspicious third-party sellers on marketplaces such as Amazon, eBay, Newegg, and Walmart. These ""deals"" have a high likelihood of not shipping; use due diligence in reviewing deals.

* Use common sense - if the deal seems too good to be true, it probably is.
* Check seller profiles for signs that the sale may be fraudulent:
    * The seller is new or has few reviews. 
    * The seller has largely negative reviews (on Amazon, sellers can remove negative reviews from their visible ratings)
    * The seller is using a previously dormant account (likely the account was hacked and is now being used fraudulently).

If you suspect a deal is fraudulent, please report the post. Moderators can take action based on these reports. We encourage leaving a comment to warn others.


*I am a bot, and this action was performed automatically. Please [contact the moderators of this subreddit](/message/compose/?to=/r/buildapcsales) if you have any questions or concerns.*"
649,Also available on NewEgg's ebay store for the same price.
650,"In for one, $120.39 shipped to FL. Guess I’m finally building another pc.


Edit: Purchased through eBay"
651,"I have built in this case twice. 

I used air coolers in both - Thermalright Silver Soul 135 and 110.

For motherboards with an internal USB C header, I used a Type E to Type C Adapter connected to a short USB C male to female extender cable, and connected that to the cable that leads to the front USB C port. That way I was still able to connect a USB C hub to the rear USB C port. Best to find one with a longer cable so you can easily get to the ports. Below are links to the different parts I used, along with a pic.

Type E to Type C Adapter - [https://www.amazon.com/gp/product/B0B9ZV6ZWN/](https://www.amazon.com/gp/product/B0B9ZV6ZWN/)

USB C Extension Cable - [https://www.amazon.com/gp/product/B0C9STSC2B/](https://www.amazon.com/gp/product/B0C9STSC2B/)

USB C hub - [https://www.amazon.com/gp/product/B0C73F5T3F/](https://www.amazon.com/gp/product/B0C73F5T3F/)

&#x200B;

https://preview.redd.it/i3fauy0xfxrb1.jpeg?width=918&format=pjpg&auto=webp&s=69146a3b845561a7dcaaaa1987ca28723e7a6d66"
652,A nice one if you wanna go itx
653,"Dang, that's a good deal. Might have to snag one for myself. Thanks for sharing!"
654,It goes on sale for this price every few months so if you don't want to get one now don't sweat it.
655,Finally!! Been waiting on this. Thanks OP.
656,Damn. Planned around an matx mobo but bought this case..now gotta get a mitx am4 board ha
657,"Pretty decent case to build in and a good deal considering the PSU included. I got one and slapped an Asrock ITX B550 board in there with AMD Ryzen 5600X3D, EK AIO 240 for the CPU and a Gigabyte Vision RTX 3080. Works well as a living room/home theater/gaming PC."
658,This is an \*excellent\* ITX case and just about a no-brainer at this price. The included PSU is quite good unlike the one NZXT saddled the H1 V2 with. My only real gripe is that HYTE is still shipping the goofy USB-C extension cable to drive the front I/O... though if you're using a budget board without an internal header that may actually be a pro and not a con.
659,What would be a good 1080p build for this case
660,I bought one of these last time it was on sale and HATED it.
661,what band psu is it
662,"Even at this price, the H1 V2 at $199 makes much more sense. You’re getting a AIO with much better looking case and pre-set cable management. Simplest and best case I’ve ever had. My undervolted overclocked 6800 xt trio doesn’t even reach 60c and the i5 12400 CPU is even better."
663,I wish they still made this with the copper mesh. :(
664,"good case, they sent me a replacement panel for free when it got hit by a car"
665,I wish I could buy the case by itself I don't need the psu
666,"How awful would it be for cooling to put this on its side? I'm looking to get a htpc where I'm height limited. So far I haven't found many great options under 10"" height.

Considering a sff PSU is over $100 by itself, this seems like a great deal"
667,"Built my girlfriends pc in this, no issues over a year later. Air cooler, 10400 and a 1070. She plays just retro stuff so that doesn’t push it but I’ve played the last of us on it and it got good results. Deff recommend if you want something small and not too ugly"
668,"Psu is B tier I believe, gray deal"
669,"Bought but newegg came back and said it was out of stock.

Got refunded :("
670,I picked up one from Adorama the last time it was on sale a little less than 3 months ago. It was just a few dollars cheaper than this NewEgg sale price.
671,"If you are building fresh, and don't already have parts from AM4, it would be wise to sink the little extra cost into AM5. you'll have a lot more options down the road for upgrading again."
672,"Ryzen 5 5600, RX 6600XT, cheapest B550 ITX you can find."
673,"Get the ryzen 7600, no hesitation. Pick up a used gpu on ebay - i got a 3060 ti. Then, get the cheapest itx mobo you can find for the ryzen 7600 - mine was some gigabyte for $140.

w/e gen4 2tb nvme SSD you can get your hands on that pops up here on sale.

I grabbed 32gb of ram for $80 or something. Do *not* go with only 16 - you only have 2 ram slots.

If you go with AMD cpu, do **not** get a tower cooler for your cpu. They can **not** be configured to blow out the side/back of the case. I think intel cpu coolers can freely orient in any direction but I'm not sure. This might be a valid reason to go intel cpu here - to save money on the cooler.

For AMD: AIO, or the dark rock tf 2, or maybe the noctua nhc14s are more optimal. I went through a few $30-$40 tower coolers, and they all cool it enough to reach near peak speeds during benchmark and it doesn't thermal throttle for gaming, but the dark rock did much better while also keeping the gpu cooler due to better air flow in the case. I got my dark rock tf 2 used on amazon for like $50, not a scratch on it."
674,"Don't have great suggestions to give off-hand, but you can check out some builds that others have done in the case at /r/sffpc and see what wisdom they may have to pass on"
675,Ryzen 7600 and Radeon 7600 lol
676,what is your budget?
677,5700xt and an i5 12400f
678,Was it just the size or cable management? Curious what made you hate it.
679,"Same here. Bought them on similar sale and returned it. The space for GPU doesn't align correctly, and has to be wedged against the PSU housing. It works, but you are putting unnecessary pressure on the PCI slot. You will have to remove the PSU housing's back cover for a better fit. Even then, you still have little to no room because of the PSU's cables coming out of the SFX-L, including a SFX PSU instead would mitigate the problem...

On top of that, you will need a right angle adapter for your GPU's power plugs, for most decently powerful cards anyway. At the end of the day, you can force everything in and shut the door, of course.

It's a good deal when using a small GPU though. But I don't think this case is intended for that kind of build, plenty of smaller cases out there."
680,It’s an iBuyPower branded PSU. FWIW I haven’t had any issues with mine (running a 13700K + 4070 Ti).
681,"Does the H1 v2 fit a 4090? The jute one does…
Except the included power supply couldn’t handle it I combination with a 12900k."
682,"I wish I already had a m-atx motherboard. Otherwise, I would totally snag one. Now I either save up to move my existing pc into a new case, ooooooor just build a whole new pc lol"
683,"H1 is limited to that single fan (140mm) AIO -- big design flaw imo  

where as this Hyte Revolt 3 supports 240mm and 280mm AIO"
684,You can buy it without the PSU. The problem is that it costs more than this. Go figure!
685,"I had one in a horizontal configuration, I set it up on a pack or 3/4"" height rubber feet that I got from Amazon to make sure it wasn't blocking an entire mesh panel - worked really well at cooling a 13600k with a C14S and a 6800XT (both undervolted). I swapped out the PSU to an SF750 for clearance and cable management, but the case itself rocks for a horizontal HTPC application."
686,Wish I could sell the PSU for $100... probably could only fetch $30-$40 for it.
687,I thought about it but got the 5600x for 130. I’m doing 3 value builds so trying to keep costs relatively low
688,800 usd
689,"I don't hate the case, I've built a few already. My beef with it is the cable layout. All your front IO stuff needs to get connected, but for some reason they insist on making the cables just a bit shorter than what you need. Then it has a hokey solution for the USB-C being an extension to the USB-C header in the rear IO. I'm also not fond of the fan placement. It's kinda inadequate for a high wattage system unless you're rocking an AIO."
690,"Those are check ones that reviewers use and it's not so simple. The case was poorly made, to begin with, and the power cables fit way too tightly in to my motherboard.  If you look at the features this case offers, you should plan to lose one for every one you take advantage of. Also, it looked a lot uglier than I thought it would when I saw it in person.

That said, if you like the look, and if my quality issues were just a bad copy, and I'd you plan out your build very carefully, you might be fine with it."
691,"reminder: Hyte is a subsidiary of iBuyPower. 

Also iBuyPower is the seeding company for NZXT. The owner-CEO Alex Hou is the father of NZXT's owner-CEO, Johnny Hou."
692,Says it fits 3-slot wide to 324mm length but not actual 3-slot cards
693,"That's excellent to hear, thank you. Part of what makes this case a good value is the PSU. Kind of sucks that I might need to replace it."
694,"This is about as value as it gets for this case with decent gaming performance.

[https://pcpartpicker.com/list/gxVLsh](https://pcpartpicker.com/list/gxVLsh)

You can go with a cheaper GPU if you want to save $50, but I refuse to purchase 8gb cards from this point forward."
695,"Here are 3 options

$830 AM4: the processor can be dropped to 5600, but I'd say the $30 is worth the extra 2 cores to keep background tasks from slowing games. You may need to update the bios with this. see the note at bottom of link

https://pcpartpicker.com/list/NLFY9c


$930 12th Gen i5: puts you on a ddr5 newer platform with more upgrade options that will exceed the max potential of the AM4 build. It will cost $100 more upfront though. I would pick this option.

https://pcpartpicker.com/list/TPzH28


$940 AM5 is the best choice for itx due to low power consumption, but at your budget greatly limits your motherboard option.

https://pcpartpicker.com/list/Ny8xsh"
696,"I've heard connecting the usb-c is a nightmare in this case, which matters if you want to use it for VR. It's a shame that more cases don't have handles."
697,Pretty close to what I got! I did go with a 6800 refurb I got for 320 though. And going with stock stealth wraith cooler.
698,"Oh yeah, that was another thing. I'm not sure if it's been revised, but it comes with a USB pass-through cable, not a connection to your board's internal Type-C header. That can be good or bad, depending on your board. It seems like the front panel Type-C cable should be replaceable, but it would take some work and research to source the correct kind of replacement."
699,"The front USB-C port simply plugs in via a pre-wired USB extension cable into the USB-C port on your motherboard's rear i/o.  I'm genuinely puzzled how someone would view plugging in a USB cable as being a ""nightmare"".  This allows you to use that case front USB-C port even with an older/cheaper motherboard that lacks an internal USB-C header.  Works perfectly fine with my VR headset."
700,hell of a trade off if that cooler fits. that'll be a solid 1440p machine.
701,"If you have about $200 to spare, the quadro RTX A2000 is an amazing card, providing RTX 3050 performance, only drawing about 70W. RX6400 is also an OK  option, but  you dont have pcie 4.0 so it may not be the best. Also get a boot SSD, like a 240GB one for about $15-20"
702,"I was in your position man, went with the 1030, paid like 97$ for it. Trust me man, just sell that shit and buy a normal pc, you can get a way better gpu for good money in today's market"
703,"Dell's galaxy-brained decision to put the PCIe 3.0 x16 slot right next to the PSU means you can only use single-slot low profile cards. The RX 6400 is the most powerful of these, but you can't get full performance out of it without a PCIe 4.0-capable system. Personally I'd try to find an Nvidia T600. It's a cut down GTX 1650 with a 40W TDP that should trade blows with the GTX 1630."
704,"I have an old Dell (i5-4590) I set up for my son with an RX 560 I got for $50 used on ebay. It plays Fortnite (\~55fps), Minecraft, and Star Wars Battlefront 2 (\~100fps) fine at 900p.

Honestly, I wouldn't sink a lot of money into SFF box. So that 560 and and SSD would be all I'd commit to it. I'd also try to move the cables around to make sure the airflow is as unrestricted as possible. Dell cases in general are pretty closed-up, and SFF is only going to make that worse."
705,"hi
you will be limited by the PSU as 200watts is quite low
go for a 1050ti as it drain 75 watts maximum through the pic express port.

a 1650 would be suitable according to this thread
https://www.reddit.com/r/sffpc/comments/gjb0jc/gtx_1650_lp_in_a_250w_psu/

a 1660 require more power roughly 120/130 watts so it will not be suitable for you.

as many, I will advice you to put a SSD into your pc and you would be fine"
706,"Gt 1030 or wx pro 3100 for single slot height lower power. 

1050 ti or 1650 for a double height card if you aren't using your second pcie slot. 

Does that rig have pcie 4.0? If so you could check rx 6400

I have a gt 1030 in a sff w/ i5-3470, runs overwatch great at 1080p, most graphically intensive games I've played are control and nioh, both run great on lowest settings possible. Tried running elden ring once on it, hard no. But it does dark souls 1,2,3"
707,"RX 550, GT 1030 or at the very least a GTX 745. A 730 isn't really worth the money compared to using just the Intel UHD 630.

The best card for that PC would be the RX 6400. Lesser cards like GTX 1050 Ti or RX 460/560 can be found without power connectors, but for safety I would keep the GPU TDP to around 50W maximum considering your power supply.

Also, get an SSD for the main drive."
708,Check out external graphics cards. You may be able to get a decent one with today's prices
709,"It looks like you are seeking tech-advice. If you haven't already, please add the specs of your computer to the question details.

>**r/lowendgaming Rules**
>
>3\. **All tech-advice posts must state your PC specs** Running dxdiag or an application like [speccy](https://www.piriform.com/speccy) can help you easily figure out your specs.

*I am a bot, and this action was performed automatically. Please [contact the moderators of this subreddit](/message/compose/?to=/r/lowendgaming) if you have any questions or concerns.*"
710,I'd consider upgrading the psu if you can office pc power supplies tend to have jssues later on.
711,"I have a 750ti that played (original) Dead Space max detail, 1080p 60fps; GTAV on a mix of normal to high settings (more than the 2GB VRAM would've let me up textures). Haven't played those others, though. But there's a bit of a reference point for you.

A 730 is pointless, wouldn't really go with a 1030. If you're buying retail, options aren't great, both in terms of availability and value. Least-worst would be a low-profile 1650, I guess. Even if buying secondhand, the SFF really limits options. So yeah, I'd probably just get that, new or used, would cover all those games well enough (depending on your standards).

And yeah, being PCI-e 3.0, I'd avoid the RX 6400 or RX 6500, unless in the unlikely event you stumbled on some amazing deal and understood you would be sacrificing performance.

An SSD would be a nice QoL upgrade too, and SSD prices are dropping significantly so it's a good time (albeit I'm seeing this more in the nvme space...does the 3080 have an m.2 slot?). It'll make your life nicer and load things faster, but don't expect it to improve FPS.

&#x200B;

EDIT: Someone else noted this case can only take single-slot cards, so that may invalidate my (and others) recommendations!"
712,"Best options: RTX A2000.
Next best: GTX 1650 or RX 560

Whatever card you get, make sure it doesn’t use more than 75 Watts and has no external power connectors required."
713,"1650 Super, great on a budget and great performance too"
714,$200 where? Secondhand? Why bother with a Quadro at this point?
715,"According to ETA Prime on YT a bunch of used 6GB models have been showing up on eBay and Amazon lately, though it's closer to $250 IIRC. The A2000 is the fastest low profile GPU on the planet, not that it matters because it's dual-slot and won't fit in OP's case."
716,">a bunch of used 6GB models have been showing up on eBay and Amazon lately

Former mining cards? And looking at ebay they're nearly all over $250.

I guess I didn't really consider it being low profile, and the efficiency is very appealing, especially in some parts of the world right now (but also just in principle).

But if someone is willing to go secondhand to get the A2000, I wonder if it wouldn't make more sense just to flip the SFF in favor of a full height case and get a similarly performing or better GPU for less. You're still paying a premium for it being a Quadro."
717,"> You're still paying a premium for it being a Quadro.

Does it really matter if you still get the best performance LP GPU?"
718,"Be mindful of recent listings of in-demand products from suspicious third-party sellers on marketplaces such as Amazon, eBay, Google, Newegg, and Walmart. These ""deals"" have a high likelihood of not shipping; you should do your due diligence to ensure you do not get scammed. 

* Use common sense - if the deal seems too good to be true, it probably is.
* Check seller profiles for signs that the sale may be fraudulent. 
    * The seller is new or has few reviews. 
    * The seller has largely negative reviews (on Amazon, sellers can remove negative reviews from their ratings- viewing seller profiles allows you to see these complaints) 
    * The seller has a recently reactivated account (likely their account was hacked and is now being used fraudulently). 

If you suspect a deal is fraudulent, please report the post. Moderators can take action based on these reports. We encourage leaving a comment to warn others. 

Amazon and eBay generally have good buyer protection. If you choose to purchase from a third-party seller through their platforms and run into issues, it should be easy to get your money back promptly. You may have more difficulties with Newegg or Walmart.


*I am a bot, and this action was performed automatically. Please [contact the moderators of this subreddit](/message/compose/?to=/r/buildapcsales) if you have any questions or concerns.*"
719,Does anywhere else stock Fractal cases at MSRP? I really want a Torrent but don't want to buy from Newegg. B&H sort of does but they drop ship it and told me they don't know when it would get to me.
720,Is this IT chief for SFF?
721,"Also available on Ebay sold by Newegg:

[Black](https://www.ebay.com/itm/295345123630)

[White](https://www.ebay.com/itm/295345123591)"
722,"This is a great case, but rn I can’t wait to get my hands on the fractal north"
723,"I have this case in white. Let me know if anyone has questions.

https://www.reddit.com/r/sffpc/comments/z8fh15"
724,One day I’ll make a build with this case. Looks so nice.
725,i had this case. Thermals are absolute dog shit and very annoying to build in
726,Has the 4.0 risen cable error or not?
727,The real question is can I fit an EVGA 3070 in here?
728,"A lot of the larger 3080s-3090tis and 4070tis-4090s wouldn't fit in this and if they did, the thermals would be pretty bad. I had a node 202 and these vertical cases can't get rid of more than 500watts of heat well."
729,"I must be dyslexic, I didn’t know this was r/BuildAPCMSRP"
730,There's a picture of someone with a stock 3090ti in it... How can anything survive in there?
731,Too bad it's Newegg...
732,"Do you think this case will still be in production for a while?

I plan on building a sff PC for my living room over the summer, and I really want this case. I know it's been sold out for a while so I don't want it to disappear on me when I'm ready to buy/build. I suppose I could buy it now and sit on it, but I'd really rather not if it won't get discontinued anytime soon."
733,"I think my next build may be SFF. I literally just bought a mini PC that was on sale with some good specs, but looking at this I had an extra battery and GPU laying around that makes me wonder if I should have went this route.. 

Would have cost me about $50 bucks more at least to get this instead (well I have an extra 500GB SSD laying around too that's already included in the mini PC as well as extra RAM) based on what I already have extra of. May accidentally end up with 3 PC's. I normally make old ones severs though to be fair. I really like the idea behind a nicely built SFF that actually supports full size GPU's. I can utilize even old GPU's on my servers and I might make em public facing for extra oomph. Can add it as a gaming server and media server as well remotely."
734,what's the significance of this case specifically? like why is it sought after over other cases?
735,I haven’t kept up to date but how does this compare to a fractal node 202?  Thermals better with the ridge or node 202?
736,Still rocking the Node 202 in 2023 :)
737,How does the Ridge compare to the Node 202? Specifically interested in size and thermals. It seems from the product description that the ridge is a tad wider.
738,"I broke down and bought the case from B&H photo. Purchased on 1/8, got shipping notification on 1/11, and got the case delivered on 1/17. So not ideal to have to rely on a drop shipment, but not a bad experience overall.

Edit: This was the Fractal Design Torrent"
739,Microcenter ships cases as well. I believe they tend to be around MSRP but that's hit or miss depending on the sale that week.
740,Walmart maybe
741,I ordered some fractal hdd trays from B&H which they quoted at 2-4 weeks and it got to me in less than a week. I'd gamble on them again
742,In the same boat. Is that why B&H haven’t been in stock for 3 weeks?
743,I got my north from Newegg with no issues
744,What has been a problem with Newegg recently? Did they fuck up again?
745,I just got a torrent nano from Newegg. Came in like 3 days in perfect condition.
746,"I mean, if you like the look. It's a nice console style case, but cases are totally dependent on what you want/need/like. Especially SFF."
747,[deleted]
748,Might need a gen4 riser and check the dimensions for your parts.
749,SFF? It looks the size of a PS5 from the user photos. Those things are massive and barely smaller than a mid-tower
750,"[Per fractal](https://www.fractal-design.com/ridge-riser-card-pcie-4-0/) seems like this is technically the 4.0 cable but some may experience instability with it, so they recommend setting it to 3.0 if you have issues, and they updated the listing to only state 3.0 for now."
751,It should have no issues fitting that card.
752,Yes.
